{
  "schema": "strawnt-app-manifest/v1",
  "id": "sys-file-manager",
  "name": "File Manager",
  "kind": "system",
  "source": "system",
  "install_state": "registered",
  "execution_backend": "wine",
  "engine": "proton-ge",
  "powered_by": "Wine",
  "powered_by_wine": true,
  "compat_status": "PARTIAL",
  "scopes": {
    "manifest": "PASS",
    "launch": "PASS",
    "ui": "PARTIAL"
  },
  "protected": true,
  "system_app": true,
  "dedicated_role": "file_manager",
  "honesty": {
    "full_windows_claimed": false,
    "ranked_anticheat_claimed": false,
    "simulated": false
  },
  "notes": "NTW6 dedicated system app 'file_manager' — thin vertical slice; Hub=Electron; powered by Wine"
}
