{
  "schema": "strawnt-app-manifest/v1",
  "id": "sys-run-dialog",
  "name": "Run Dialog",
  "kind": "system",
  "source": "system",
  "install_state": "registered",
  "execution_backend": "wine",
  "engine": "proton-ge",
  "powered_by": "Wine",
  "powered_by_wine": true,
  "compat_status": "PARTIAL",
  "scopes": {
    "manifest": "PASS",
    "launch": "PASS",
    "ui": "PARTIAL"
  },
  "protected": true,
  "system_app": true,
  "dedicated_role": "run_dialog",
  "honesty": {
    "full_windows_claimed": false,
    "ranked_anticheat_claimed": false,
    "simulated": false
  },
  "notes": "NTW6 dedicated system app 'run_dialog' — thin vertical slice; Hub=Electron; powered by Wine"
}
